{
  "$schema": "../public-contract.schema.json",
  "schemaVersion": 1,
  "contractVersion": 1,
  "packageVersion": "1.0.0",
  "status": "candidate",
  "policyDigest": "sha256:fd1812eedf37c6e6e01e8376f25154c41f207213f9fb5cf8663c595abe9fa0e5",
  "release": {
    "id": "first-local-only",
    "serverName": "bga-mcp",
    "entrypoint": "dist/release-cli.js",
    "bin": {
      "bga-mcp": "dist/release-cli.js"
    },
    "exports": {
      ".": {
        "types": "./dist/index.d.ts",
        "import": "./dist/index.js"
      }
    },
    "typesDigest": "sha256:38ae3f8e1dfec1e0a67672882444888b0f64b863054f22b3fb4f1d73c74f7566",
    "protocolVersions": ["2025-11-25"],
    "transports": ["stdio"]
  },
  "tools": [
    {
      "name": "audit_database_usage",
      "metadataDigest": "sha256:54d20769afd386b4e2705dc1158c37cbf07475447cf2187181ddbce9b0361745",
      "inputSchemaDigest": "sha256:d1dc2ae488eda4d03223558208ee5aed98b908e04eefba40ae59936cdbfb3c2c",
      "outputSchemaDigest": "sha256:0327829ba24247957ff603c3c4679a99e1697e360461ffdae0bf5769651f57c0",
      "manifest": {
        "stability": "verified",
        "supportedLayouts": ["legacy-flat", "modern-modules", "part-migrated"],
        "environments": ["local"],
        "protocolVersions": ["2025-11-25"],
        "liveStudioRequired": false,
        "boundary": "TB-LOCAL-FILESYSTEM"
      }
    },
    {
      "name": "inspect_project",
      "metadataDigest": "sha256:36ad50fc603a5f915ac804c8c16f97b33def365ac321f5f0ca7dd131ad777004",
      "inputSchemaDigest": "sha256:d1dc2ae488eda4d03223558208ee5aed98b908e04eefba40ae59936cdbfb3c2c",
      "outputSchemaDigest": "sha256:fb93f261c2b7cb2e31be448349d79e300f9bc9c5e9d6fdf847d5cf08a5d5bd75",
      "manifest": {
        "stability": "verified",
        "supportedLayouts": ["legacy-flat", "modern-modules", "part-migrated"],
        "environments": ["local"],
        "protocolVersions": ["2025-11-25"],
        "liveStudioRequired": false,
        "boundary": "TB-LOCAL-FILESYSTEM"
      }
    },
    {
      "name": "run_pre_release_audit",
      "metadataDigest": "sha256:d8b4c4a6060912652d6b6150cf1405d631cabdb2b1a039e7320d5bc8b200cc54",
      "inputSchemaDigest": "sha256:d1dc2ae488eda4d03223558208ee5aed98b908e04eefba40ae59936cdbfb3c2c",
      "outputSchemaDigest": "sha256:f1d249231ec0b1189cce07cb3ab5b312b556bdc3a119fd1f1c83cd25f5857d13",
      "manifest": {
        "stability": "verified",
        "supportedLayouts": ["legacy-flat", "modern-modules", "part-migrated"],
        "environments": ["local"],
        "protocolVersions": ["2025-11-25"],
        "liveStudioRequired": false,
        "boundary": "TB-LOCAL-FILESYSTEM"
      }
    },
    {
      "name": "validate_action_contracts",
      "metadataDigest": "sha256:3b61ef43cb3e2f38a98e96de641352b67b9f0ed5ddc74973ae81d038f6e69cf9",
      "inputSchemaDigest": "sha256:d1dc2ae488eda4d03223558208ee5aed98b908e04eefba40ae59936cdbfb3c2c",
      "outputSchemaDigest": "sha256:b3382f7f4da0a01c80dc31c6e739b77ffcf8286f470ed616c4658bc482c01527",
      "manifest": {
        "stability": "verified",
        "supportedLayouts": ["legacy-flat", "modern-modules", "part-migrated"],
        "environments": ["local"],
        "protocolVersions": ["2025-11-25"],
        "liveStudioRequired": false,
        "boundary": "TB-LOCAL-FILESYSTEM"
      }
    },
    {
      "name": "validate_notifications",
      "metadataDigest": "sha256:e3e511af5cac788d7db57957f6515ade078b1467cd945cb5b1b2b1b950dd481d",
      "inputSchemaDigest": "sha256:d1dc2ae488eda4d03223558208ee5aed98b908e04eefba40ae59936cdbfb3c2c",
      "outputSchemaDigest": "sha256:375dce0bf25aa2ecd1e7f7f28bf10f82f11b52464a9c50ec5b987e59901e6ab8",
      "manifest": {
        "stability": "verified",
        "supportedLayouts": ["legacy-flat", "modern-modules", "part-migrated"],
        "environments": ["local"],
        "protocolVersions": ["2025-11-25"],
        "liveStudioRequired": false,
        "boundary": "TB-LOCAL-FILESYSTEM"
      }
    },
    {
      "name": "validate_project",
      "metadataDigest": "sha256:e600cfc7e40d090460699fc94081ffbdcb8282f3abf3893d9e5b930a6110cb15",
      "inputSchemaDigest": "sha256:502e6f4e0b1c181e5d55a9c2bd2d21e4787efc22c85676f4f5a46cfbf9e9eea2",
      "outputSchemaDigest": "sha256:6e0e51d7e4720d501518e4248668f47dabb17168d5b6ceed2835a1fdc8c8accc",
      "manifest": {
        "stability": "verified",
        "supportedLayouts": ["legacy-flat", "modern-modules", "part-migrated"],
        "environments": ["local"],
        "protocolVersions": ["2025-11-25"],
        "liveStudioRequired": false,
        "boundary": "TB-LOCAL-FILESYSTEM"
      }
    },
    {
      "name": "validate_state_machine",
      "metadataDigest": "sha256:3884229b0924eed8b428151ebf1fc5d41ad5d04557872e909a6ea18b4171467b",
      "inputSchemaDigest": "sha256:d1dc2ae488eda4d03223558208ee5aed98b908e04eefba40ae59936cdbfb3c2c",
      "outputSchemaDigest": "sha256:de1617a414ed6951b75a41c24bfaf34f995fdb01bcab31604f27b8f585b8e4f0",
      "manifest": {
        "stability": "verified",
        "supportedLayouts": ["legacy-flat", "modern-modules", "part-migrated"],
        "environments": ["local"],
        "protocolVersions": ["2025-11-25"],
        "liveStudioRequired": false,
        "boundary": "TB-LOCAL-FILESYSTEM"
      }
    }
  ],
  "resources": [
    {
      "uri": "bga://project/diagnostics",
      "descriptorDigest": "sha256:1eef753fef6db291d3fe09b2aa53e34f43644c028120baf13dba6e0aaee92788",
      "manifest": {
        "stability": "verified",
        "supportedLayouts": ["legacy-flat", "modern-modules", "part-migrated"],
        "environments": ["local"],
        "protocolVersions": ["2025-11-25"],
        "liveStudioRequired": false,
        "boundary": "TB-LOCAL-FILESYSTEM"
      }
    },
    {
      "uri": "bga://project/states",
      "descriptorDigest": "sha256:2d60850074a51674f1cfa8343ca4b21a31def9138eb85339b64613343cf3951a",
      "manifest": {
        "stability": "verified",
        "supportedLayouts": ["legacy-flat", "modern-modules", "part-migrated"],
        "environments": ["local"],
        "protocolVersions": ["2025-11-25"],
        "liveStudioRequired": false,
        "boundary": "TB-LOCAL-FILESYSTEM"
      }
    },
    {
      "uri": "bga://project/summary",
      "descriptorDigest": "sha256:8abf3f9c8db34dc6933e6fdc299acf756bb1e61b50b51b7ac90e678c57b98a8d",
      "manifest": {
        "stability": "verified",
        "supportedLayouts": ["legacy-flat", "modern-modules", "part-migrated"],
        "environments": ["local"],
        "protocolVersions": ["2025-11-25"],
        "liveStudioRequired": false,
        "boundary": "TB-LOCAL-FILESYSTEM"
      }
    }
  ],
  "resourceTemplates": [],
  "prompts": [],
  "schemas": [
    {
      "path": "config/capabilities.schema.json",
      "compatibility": "package-major",
      "contractVersion": null,
      "digest": "sha256:1dca06d9fea968c22fd302529bb31587896e522d7d1dab6fd2274dcb2b28c0f5"
    },
    {
      "path": "config/compatibility.schema.json",
      "compatibility": "package-major",
      "contractVersion": null,
      "digest": "sha256:2d3b05167cf03714ea02a21d68ba58ac0e78f0ab001067c9da5c8cd329c9f23f"
    },
    {
      "path": "config/diagnostics.schema.json",
      "compatibility": "schema-version",
      "contractVersion": 1,
      "digest": "sha256:502f80d5909491092c155428ed5b176d0889d1bf85ff188d2cae44423ec936c0"
    },
    {
      "path": "config/doc-evaluation.schema.json",
      "compatibility": "package-major",
      "contractVersion": null,
      "digest": "sha256:6c7aa85d3580c784ec2f988ca48a01af28a4236aef93907d09fe430bbeb3bb7a"
    },
    {
      "path": "config/doc-sources.schema.json",
      "compatibility": "package-major",
      "contractVersion": null,
      "digest": "sha256:f49f64fb0a9458e904f9bfd25070c78c1a19478bd3cf649635e22b5c94571e62"
    },
    {
      "path": "config/public-contract.schema.json",
      "compatibility": "package-major",
      "contractVersion": null,
      "digest": "sha256:179a29662d5bba3859e72a4b948eca43ffb591b08be8f8deb01a781e8288ae31"
    },
    {
      "path": "config/release.schema.json",
      "compatibility": "package-major",
      "contractVersion": null,
      "digest": "sha256:12183d4c80c5d3da8475ffe4a3b02d2c2c3eda2f5280afa6e22fc272a5b4dc6b"
    },
    {
      "path": "config/rule-catalog.schema.json",
      "compatibility": "package-major",
      "contractVersion": null,
      "digest": "sha256:fce8cf8113db964c68adc2e25e9756b93b0305e6b3cf83ff863b2db67f57292c"
    },
    {
      "path": "config/version-policy.schema.json",
      "compatibility": "package-major",
      "contractVersion": null,
      "digest": "sha256:966207bd0d55244c903e00cfe095eec2ab062ddfabcc6eb0b985870edc30251f"
    },
    {
      "path": "runtime:public-error",
      "compatibility": "schema-version",
      "contractVersion": 1,
      "digest": "sha256:22ee865ca1671bcd18b6173d25d6624ab974033ac00c2e1cf48f58c858bdefad"
    }
  ],
  "compatibility": [
    {
      "id": "CLAIM-CLIENT-EDITORS",
      "dimension": "client",
      "value": "editor and agent clients",
      "support": "unknown"
    },
    {
      "id": "CLAIM-CLIENT-SDK",
      "dimension": "client",
      "value": "@modelcontextprotocol/client 2.0.0",
      "support": "supported"
    },
    {
      "id": "CLAIM-CONTRACT-EXECUTABLE-CONTEXT",
      "dimension": "file-generation",
      "value": "static-contract-executable-context",
      "support": "supported"
    },
    {
      "id": "CLAIM-ENVIRONMENT-LOCAL",
      "dimension": "environment",
      "value": "local",
      "support": "supported"
    },
    {
      "id": "CLAIM-FILEGEN-LEGACY",
      "dimension": "file-generation",
      "value": "inc-php-metadata",
      "support": "supported"
    },
    {
      "id": "CLAIM-FILEGEN-MODERN",
      "dimension": "file-generation",
      "value": "json-metadata",
      "support": "supported"
    },
    {
      "id": "CLAIM-LAYOUT-HYBRID",
      "dimension": "layout",